iteration	timestamp	gaps_found	fail_count	concern_count	applied	saturation_status	loop_status	notes
0	2026-07-16	1	0	1	1	ACTIVE	CONTINUE	baseline: outer-pvl CONDITIONAL (sharp premise concern, fixed in-pass V6)
1	2026-07-16	9	0	1	9	PLATEAU	HALTED_SUCCESS	inner R+I+supplement applied 9 gaps; inner-pvl CONDITIONAL accepted (sole concern = sharp devDep, resolvable only by EXECUTE A0)
2	2026-07-17	0	0	0	0	SATURATED	HALTED_SUCCESS	EVL confirmation: 14 gates + 4 validators green; a11y GREEN for phase attribution (8 pre-existing fails, 0 new; baseline undercount noted as follow-up)
1	2026-07-17	7	0	1	7	PLATEAU	HALTED_SUCCESS	phase-02: inner R+I+supplement (6 items) + inner-pvl CONDITIONAL accepted (concern resolved in-pass via Step C0; B2 mechanism empirically proven)
1	2026-07-17	15	0	4	15	PLATEAU	HALTED_SUCCESS	phase-03: inner R+I+supplement (11 gaps) + inner-pvl CONDITIONAL accepted (4 concerns resolved in-pass; E6-E9 added; baseline re-drift 38/14)
2	2026-07-17	1	1	0	0	ACTIVE	CONTINUE	phase-02 EVL: 10 gates green, a11y 0-new; full suite 38/39 — failing assertion caused by USER hot-fix (Get Pro->Support Us! in page.client.tsx, out of blast radius); repair assigned to Phase 3 EXECUTE (file in its radius); Phase 2 attribution clean
3	2026-07-17	1	1	0	0	ACTIVE	HALTED_SUCCESS	phase-02 EVL closed: known-gap accepted under /goal (38/39 fail = user hot-fix out of radius; repair carried to Phase 3 EXECUTE, file in its radius); iteration report evl-iteration-001 written
2	2026-07-18	2	2	0	0	ACTIVE	HALTED_SUCCESS	phase-03 EVL closed: in-radius gates all green (45/45 full, 15/15 scoped, a11y 0-new, 4 validators, radius guards); build+tsc red 100% foreign (queries.ts 33 + use-analytics.ts 2 errors, user in-flight console-errors work) — known-gap accepted, resolution path = console-errors-cleanup plan; report evl-iteration-001 written
1	2026-07-18	8	0	3	6	PLATEAU	HALTED_SUCCESS	phase-04: inner R+I+supplement (A1/B1/B2/C2 updated, D1-D5 locked) + inner-pvl CONDITIONAL accepted (P1 stale a11y baseline 5->8 fixed in-pass; OUTPUT_DIR fixed-in-plan; SSH recon = ask-user hand-off); contract superseded outer-pvl 16-07-26
2	2026-07-18	0	0	0	0	SATURATED	HALTED_SUCCESS	phase-04 EVL closed: in-radius gates all green (48/48 vitest, grep/diff guards clean, a11y 0-new with 6 foreign fails vs 8 baseline = net improvement, visual-evidence 11/12 sole miss foreign RPC PGRST202); build+tsc 35 errors 100% foreign exact-match backlog note; report evl-iteration-001 written
